{
  "assignment_id": null,
  "blocks": [
    {
      "markdown": "hi",
      "type": "text"
    }
  ],
  "chat_id": "chat_main",
  "created_at": "2026-10-09T10:19:02.312Z",
  "deleted": false,
  "delivery": [],
  "edited_at": null,
  "fallback_text": "hi",
  "id": "msg_1",
  "intent": null,
  "mentions": [],
  "quote": null,
  "reactions": [],
  "reply_to": null,
  "sender": {
    "kind": "user"
  },
  "seq": 1,
  "streaming": false,
  "thread_count": 0
}
